{"$schema":"markata://schemas/content-index/v1","schema":"markata.content-index","schema_version":1,"generator":{"name":"markata-go","version":"fixture"},"source":{"commit":"0123456789abcdef0123456789abcdef01234567"},"document_count":2,"documents":[{"path":"posts/unicode-é.md","slug":"unicode-é","href":"/unicode-é/","title":"こんにちは 🌱","title_text":"こんにちは 🌱","date":"2026-08-15T12:00:00Z","modified":"2026-08-16T12:00:00Z","published":true,"draft":false,"private":false,"template":"post.html","tags":["go","日本語"],"description":"A summary","feeds":["archive","blog"],"aliases":["hello"]},{"path":"pages/review.md","slug":"review","href":"/review/","title":"Review","title_text":"Review","published":false,"draft":false,"private":false,"template":"docs.html","tags":[],"feeds":[],"aliases":[]}]}
